Dr. Amarjeet Prajapati|Amarjeet Prajapati|RoeOU3UAAAAJ|46|579.0|437.0|13|12.0|15|14.0|['Harmony search based remodularization for object-oriented software systems', 'Improving Modular Structure of Software System using Structural and Lexical Dependency', 'Many-objective artificial bee colony algorithm for large-scale software module clustering problem', 'Improving package structure of object-oriented software using multi-objective optimization and weighted class connections', 'A particle swarm optimization-based heuristic for software module clustering problem', 'FP-ABC: Fuzzy-Pareto dominance driven artificial bee colony algorithm for many-objective software module clustering', 'TA-ABC: Two-Archive Artificial Bee Colony for Multi-objective Software Module Clustering Problem', 'MaDHS: Many‐objective discrete harmony search to improve existing package design', 'An empirical study of the sensitivity of quality indicator for software module clustering', 'Information-theoretic remodularization of object-oriented software systems', 'Harmony Search-Based Approach for Multi-Objective Software Architecture Reconstruction', 'Restructuring Object-Oriented Software Systems Using Various Aspects of Class Information', 'A Particle Swarm Optimization approach for Large-scale Many-objective Software Architecture Recovery', 'Two-Archive Fuzzy-Pareto-DominanceSwarm Optimization for Many-ObjectiveSoftware Architecture Reconstruction', 'Search-Based Object-Oriented Software Re-Structuring with Structural Coupling Strength', 'Multi-dimensional information-driven many-objective software remodularization approach', 'PSO-MoSR: a PSO-based multi-objective software remodularisation', 'Preserving Core Components of Object-oriented Packages while Maintaining Structural Quality', 'Optimized Test Case Generation for Basis Path Testing using Improved Fitness Function with PSO', 'Software Package Restructuring with Improved Search‑based Optimization and Objective Functions', 'An Efficient Scheme for Candidate Solutions of Search-Based Multi-objective Software Remodularization', 'Software module clustering using grid-based large-scale manyobjective particle swarm optimization', 'A comparative study of many-objective optimizers on large-scale many-objective software clustering problems', 'A bilateral assessment of human activity recognition using grid search based nonlinear multi-task least squares twin support vector machine', 'A Framework for Vulnerability Analysis during Software Maintenance', 'A Customized PSO Model for Large-Scale Many-Objective Software Package Restructuring Problem', 'Entropy-Driven Global Best Selection in Particle Swarm Optimization for Many-Objective Software Package Restructuring', 'Optimizing Software Modularity with Minimum Possible Variations', 'Video Captioning Based on Graph Neural Network Made from Action Knowledge and Object Features.', 'Recognition of Real-Time Video Activities Using Stacked Bi-GRU with Fusion-based Deep Architecture', 'Software Module Clustering Using Grid-Based Many-Objective Particle Swarm Optimization', 'Robustness in search-based software remodularization', 'Optimizing the software test case through physics-informed particle-based method', 'An Effective PSO-Driven Method for Test Data Generation in Branch Coverage Software Testing.', 'Many-Objective Feedback Evolutionary Algorithm for Optimizing the Software Test Suite', 'Advancing software engineering through AI, federated learning, and large language models', 'An innovative particle physics optimization algorithm for efficient test case minimization in software testing', 'A Novel Method for Sequence Generation for Video Captioning by Estimating the Objects Motion in Temporal Domain', 'A Bilateral Assessment of Human Activities Using PSO-Based Feature Optimization and Non-linear Multi-task Least Squares Twin Support Vector Machine', 'Test Data Generation for Branch Coverage in Software Structural Testing Based on TLBO', 'A Comparative Analysis of Multiclass Human Activity Recognition Using LSTM-Based Model', 'Harmony Search-Enhanced Software Architecture Reconstruction', 'Multimedia in search-based software engineering: challenges and opportunities within a new research domain', 'Software module clustering using particle swarm optimization', 'Analysis of Structural Coupling Strength in Improving Software Module Structure', 'An Approach for Vulnerability Analysis of SQL Injection in Software']|{'Dr. Ankit Vidyarthi': 4, 'Dr. Vikash': 2}|Jaypee Institute of Information Technology|0.0|nan|nan
Dr. Rashmi Kushwah|Dr. Rashmi Kushwah|I33yPegAAAAJ|30|162.0|150.0|9|9.0|8|7.0|['A modified whale optimization algorithm to overcome delayed convergence in artificial neural networks', 'Internet of things architectural elements, challenges and future directions', 'A survey on next generation IoT networks from green IoT perspective', 'Gateway load balancing using multiple QoS parameters in a hybrid MANET', 'ECDSA for data origin authentication and vehicle security in VANET', 'A detailed study on Internet connectivity schemes for mobile ad hoc network', 'Energy-efficient scheduling in IoT using Wi-Fi and ZigBee cross-technology', 'Multipath delay analysis using queuing theory for gateway selection in hybrid MANET', 'Role of artificial intelligence of things (aIoT) to combat pandemic COVID-19', 'A novel traffic aware reliable gateway selection in wireless mesh network', 'A novel technique for gateway selection in hybrid MANET using genetic algorithm', 'Enhanced gateway deployment scheme for load balancing in heterogeneous networks', 'Fuzzy logic based cluster head selection method for heterogeneous wireless sensor networks', 'Modeling of an efficient integration of MANET and Internet using queuing theory', 'Cyber security in internet of things using optimization algorithms: a systematic mapping of literature', 'IsSwap: Deep Fake Detection', 'A Novel Energy-efficient and Secure Identity Authentication Scheme for IoT Networks', 'Optimizing Energy Efficiency and Delay in IoT Networks using M/G/1 Queuing with Adaptive Vacation Policy.', 'Navigating the Cybersecurity Landscape: Vulnerabilities, Mitigation Strategies and Future Outlooks.', 'Tree-based dual load balancing scheme in wireless mesh networks with multiple gateways', 'An Energy-Efficient Clustering Approach for Two-Layer IoT Architecture', 'Web Application Based Text Encryption', 'An Optimum Source Coverage Adaptive Gateway Discovery for Heterogeneous Networks', 'Performance Analysis of Black-Hole Attack in MANET', 'A Trusted-Group Criteria for Performing Trust Aware Routing in Mobile Networks.', 'A Study of Next Generation Secure Computing Base (BitLocker) windows 8 in IT Management', 'Wireless Sensor Network Functionality and Management: a case study', 'A Trusted group criteria for performing Trust Aware routing in mobile network', 'Dense Wavelenth Division Multiplexing', 'Complexity Matrices for Component Based Software Engineering']|{'Dr. Arti Jain': 2, 'Dr. Payal Khurana Batra': 2}|Assistant Professor (Sr. Grade)|0.0|nan|nan
Dr. Shruti Jaiswal|shruti jaiswal|D_xBJQgAAAAJ|18|96.0|63.0|4|3.0|2|2.0|['Security requirements for internet of things (IoT)', 'A perspective on available security techniques in IoT', 'Security requirement prioritization', 'A framework for security testing', 'Engineering and validating security to make cloud secure', 'Security Requirements Engineering: Analysis and Prioritization ‘', 'Security validation of cloud based storage', 'Measuring Security: A Step Towards Enhancing Security of System', 'Security engineering methods-in-depth analysis', 'Multicriteria client selection model using class topper optimization based optimal federated learning for healthcare informatics', 'Harnessing the Power of NLP for Mental Health Diagnosis and Treatment', 'Student Placement Prediction Using Machine Learning Algorithms', 'Heart Failure Prediction Using Different Machine Learning Algorithms', 'Lay a hand on IOT with SAP Leonardo', 'BRAIN DATA VISUALIZATION AND PREDICTION OF ADHD DISEASE', 'Review of Feature Representation Techniques in Web APIs', 'Internet of Things Security: Challenges and Solution', 'Master of Engineering In Computer Technology and Application']|{'Dr. Himani Bansal': 2}|Assistant Professor, Jaypee Institute of Information Technology|0.0|nan|nan
Dr. Sonal|Sonal Tuteja|AlQ4YmQAAAAJ|10|51.0|34.0|3|3.0|2|2.0|"['Enhancement in weighted pagerank algorithm using vol', 'A unification of heterogeneous data sources into a graph model in e-commerce', ""Machine learning based analysis and prediction of college students' mental health during COVID-19 in India"", 'Query-driven graph models in e-commerce', 'Graph Model based Recommendation Architecture for E-commerce Applications', 'An architecture for data unification in e-commerce using graph', 'A system architecture for mapping application data into complex graph', 'Automated Examination System using Machine Learning and Natural Language Processing', 'Enhancing Campus Navigation: A Conversational AI Agent for Location Assistance', 'in E-commerce using Graph']"|{'Sarishty Gupta': 1}|Assistant Professor, JIIT, Noida|0.0|nan|nan
Dr. Vivek Kumar Singh|Dr. Vivek kumar singh|3NOBikYAAAAJ|9|49.0|35.0|3|3.0|2|2.0|['In-network data processing based on compressed sensing in WSN: A survey', 'ODECS: An on-demand explosion-based compressed sensing using random walks in wireless sensor networks', 'Fft‑asvr: an adaptive approach for accurate prediction of IoT data streams', 'Stream processing with concept drift for event identification in sensors enabled IoT environment', 'Dbcs: A decomposition based compressive sensing for event oriented wireless sensor networks', 'Network health monitoring of WSNs using node loss rate calculations', 'Energy-Aware Dynamic Virtual Machine Scheduling in Cloud Computing: A Survey', 'Sparse Matrix Completion for Effective Recommendation System', 'Jellyfish detection using wireless sensor networks']|{'Dr. Tribhuwan Kumar Tewari': 1, 'Dr. Kashav Ajmera': 1}|Assistant Professor, CSE, Jaypee Institute of Information Technolgy-Noida|0.0|nan|nan
Dr. Alka Singhal|Dr Alka Singhal|ZayqdbAAAAAJ|21|88.0|78.0|4|3.0|3|3.0|"['Stock price forecasting using data from yahoo finance and analysing seasonal and nonseasonal trend', 'Ambient Communications and Computer Systems', 'Personalized food recommendation—state of art and review', 'Social networking based E-Learning system on clouds', 'Bio-inspired approach for early diabetes prediction and diet recommendation', 'Utilizing Metaheuristic Machine Learning Techniques for Early Diabetes Detection', 'A Novel Heart Disease Prediction System Using XGBoost Classifier Coupled With ADASYN SMOTE', 'Early Diabetes Prediction Using Deep Ensemble Model and Diet Planning', 'Diet recommendation using predictive learning approaches', 'RAIS-Remotely Accessible Irrigation System', 'Learner centric and adaptive E-library based on learner feedback model', ""Analysis: Forecasting Patient's Outcomes and Medical Trends"", 'A Comprehensive Investigation of Machine Learning Algorithms with SMOTE Integration to Maximize F1 Score', 'GoTrip: an automatic ontological travel itinerary planner using SPARQL inferencing', 'Personalized E-library: A Recommender System Based on Learner’s Feedback Model', 'Energy-Efficient Network Intrusion Detection Systems in the IOT Networks', 'Performance Analysis for the Ontology based Intelligent Information Retrieval using Non Monotonic Inference Logic using SPARQL.', 'Rajni Jindal', 'APPLICATION OF SEMANTIC WEB FOR THE ENHANCEMENT IN WEB ADVERTISING AND SOFTWARE ENGINEERING', 'Ontology for Learning Object Metadata to Enhance Concept for Collaborative Learning', 'A Quality Model for E-Learning as a Service in Cloud Computing Framework']"|nan|Senior Assistant professor, JIIT, Noida 62|0.0|nan|nan
Dr. Ashish Mishra|Dr. Ashish mishra|i7NJLgMAAAAJ|46|179.0|133.0|7|6.0|6|3.0|"['A systematic review of deep learning based image segmentation to detect polyp', 'Analysis of DVFS techniques for improving the GPU energy efficiency', 'Modified efficientnetb3 deep learning model to classify colour fundus images of eye diseases', 'Information display system for switching device, switching device, and method', 'Switching device having terminal cover, and method', 'Greenhouse a reference manual', 'Primary synovial chondromatosis of the hip joint (PrSC of the hip): A retrospective cohort analysis and review of the literature', 'Analysis of structural deformation in flexible pavement using KENLAYER programme', 'Interference-based topology control algorithm for delay-constrained mobile ad hoc networks', 'Allelopathic effect of Azadirachta indica leaf extract on seed germination and seedling growth of some agricultural crops', 'Neural network-based hardware classifier using CORDIC algorithm', 'Deep Transfer Learning for Tomato Leaf Diseases Detection and Classification using Pre-trained Models', 'Sarcasm detection in news headlines using voted classification', 'Information display system for switching device, switching device, and method', 'Effect of Blast Loading on Framed Structure: A Review', 'Induction of Cryptic Metabolite Production Through Epigenetic Tailoring in Colletotrichum gloeosporioides Isolated from Syzygium cumini', 'Three-dimensional electric-field vector resistivity imaging for deep subsurface fractures network in heterogeneous crystalline rocks', 'Circuit breaker', 'Strategic Management is Essential for Organisational Growth: A Case Study of Havells', 'A Survey on Digital Image Authentication by DCT and RPM Based Watermarking', 'A survey of association rule hiding approaches', 'Role of different variables on site-specific isolation and distribution patterns of soil mycoflora from Varanasi', 'AB-deeplabv3+: An encoder-decoder method with attention mechanism for polyp segmentation', 'Meat borne parasitic zoonoses: Epidemiology, diagnosis, prevention, current issues and approaches', ""Power and Performance Characterization of the Dijkstra's Graph algorithm on GPU"", 'Fahr’s disease presenting with ischemic stroke in young adult: a case report of rare disease with unique presentation', 'Evaluating subclinical atherosclerosis, arterial stiffness, and lipid profile in patients with anti neutrophilic cytoplasmic antibodies associated vasculitis: a systematic …', 'Enhancing Hydrogen Evolution Efficiency in Alkaline Water Electrolysis Using Optimized Raney Nickel Coatings on Stainless Steel Electrodes', 'Deep transfer learning-based classification of White Blood Cells using customized classification base', 'Reimagining Human Resource Management in Higher Education: Current Trends and Future Implications', 'Automated Potato Disease Classification Using Deep Learning-A Comparative Analysis of Convolutional Neural Networks', 'Accelerated GPU-Based Clustering, Classification and Regression Using RAPIDS: A Comparative Study', 'ISL Recognition of Emergency Words Using MediaPipe, CNN and LSTM', 'Towards Safer Roads: Preventing Car Accident Probability with Machine Learning', 'Indian Sign Language Recognition Using Scale-Invariant Feature Transform by Depth Sensor', 'A REVIEW ON MALARIA, CONTROL&CHALLENGE STRATEGIES', 'Эозинофильный панкреатит: редкое или неизученное заболевание?', 'Circuit breaker', 'Energy and performance improvement using real-time DVFS for graph traversal on GPU', 'An update on fatal zoonosis, rabies: Prevention, issues and approaches', 'www. jru. edu', 'Role of different variables on site-specific isolation and distribution patterns of soil mycoflora from Varanasi.', '15 Role of Fungal Endophytes', 'Improved Polyp Segmentation with Attention and Attention-Bilstm Using Encoder-Decoder Model: A Step Towards Better Performance', 'Privacy Preservation in Data Mining By Clustering of Sensitive Association Rule', 'Digital Image Authentication by DCT and RPM Based Watermarking']"|{'Mayuri Gupta': 2}|Assistant Professor  at Computer Science and Engineering Dept,JIIT NOIDA|0.0|nan|nan
Dr. Sulabh Tyagi|Sulabh Tyagi|KBmTZoUAAAAJ|11|99.0|93.0|5|5.0|3|2.0|['Empirically developed framework for building trust in distributed agile teams', 'Adopting test automation on agile development projects: A grounded theory study of indian software organizations', 'The state of test automation in DevOps: a systematic literature review', 'Development of reusable hybrid test automation framework for web based scrum projects', 'Role of trust in distributed agile software development teams-A light weight systematic literature review', 'Lightweight Review: Challenges and Benefits of Adopting DevOps', 'Diurnal variation of ozone levels in academic hostel in Delhi—a case study of JNU campus', 'Computing in Education', 'GATT: A Genetic Algorithm-based Tool for Automating Timetable Scheduling at Netaji Subhas University of Technology', '2022 1 st International Conference on Informatics (ICI)', 'SOME INVESTIGATIONS ON CONVERGED NETWORKS']|nan|Jaypee Institute of Information Technology (JIIT), Noida, India|0.0|nan|nan
Dr Bhawna Saxena|Dr. Bhawna Saxena|Z_TtRgMAAAAJ|21|83.0|82.0|4|4.0|2|2.0|['A node activity and connectivity-based model for influence maximization in social networks', 'Hurst exponent based approach for influence maximization in social networks', 'Features driven brain tumor detection using machine learning models', 'Influence maximization in social networks using community-diversified seed selection', 'A Hurst‐based diffusion model using time series characteristics for influence maximization in social networks', 'Boosting accuracy of fake review prediction using synthetic minority oversampling technique', 'Towards establishing the effect of self-similarity on influence maximization in online social networks', 'MicroRNAs targeting critical molecular pathways in diabetic cardiomyopathy emerging valuable for therapy', 'Image-Based Crop Disease Detection using Machine Learning Approaches: A Survey', 'BO-CBoost: A Machine Learning Based Framework for Predicting the Influence Potential of Nodes in Complex Networks.', 'Community Detection in Weighted Time-Variant Social Network', 'Study of the effectiveness of wavelet genetic programming model for water quality analysis in the Uttar Pradesh region', 'Influence Maximization in Social Networks using Hurst exponent based Diffusion Model', 'Edge sign and strength based model for influence diffusion in signed social networks', 'Black marketed collusive users primary dataset from twitter/x online social media', 'Geological Time Series Analysis for Spatial Seismic Forecasting in Japan', 'Exploring the Performance of Diffusion Models in Weighted Social Networks', 'Dysphonic Voice Pattern Based Parkinson Disease Detection Using Machine Learning Models', 'Study of the effectiveness of Generative Adversarial Networks towards Music Generation', 'Analysing Machine Learning based Approaches for Detecting Late Blight Disease in Potato Crop', 'Identification and exploitation of self similarity for influence maximization in online social networks']|{'Prof. Anuja Arora': 1, 'Dr. Vikash': 4}|Department of CSE and IT, JIIT, Noida, India|0.0|nan|nan
