Name|Name on Profile|Scholar ID|Document Count|Cited by|Cited by 5 years|h-index|h-index 5 years|i10-index|i10-index 5 years|Publications|Coauthors|Affiliation|Warning|PDF Links|GSID
Prof. Manish Kumar Thakur|Prof. Manish K Thakur|MYxL_ZkAAAAJ|44|423.0|261.0|9|8.0|8|7.0|Sign Language Recognition using Microsoft Kinect; Extractive text summarization using word vector embedding; Architectural space planning using genetic algorithms; A Performance analysis of objective video quality metrics for digital video watermarking; Architectural layout planning using genetic algorithms; Crime Prediction Based on Statistical Models; A cost effective Sign Language to voice emulation system; Feature selection using autoencoders; RVM-MR image brain tumour classification using novel statistical feature extractor; Genetic algorithm-and cuckoo search algorithm-based routing optimizations in network-on-chip; A Novel Approach for Hand Analysis Using Image Processing Techniques; Modified DBSCAN Using Particle Swarm Optimization for Spatial Hotspot Identification; Learning Based No Reference Algorithm for Dropped Frame Identification in Uncompressed Video; A Full Reference Algorithm for Dropped Frames Identification in Uncompressed Video Using Genetic Algorithm; Rapid surveillance of COVID-19 by timely detection of geographically robust, alive and emerging hotspots using Particle Swarm Optimizer; Circular and cylindrical hotspots detection for spatial and spatio-temporal data; TaxiScan: A scan statistics approach for detecting Taxi demand hotspots; A New Perspective to Stable Marriage Problem in Profit Maximization of Matrimonial Websites; Intelligent Mail Box; Tampered videos: detection and quality assessment|{'Dr. Vikash': 3, 'Dr. Sherry Garg': 1, 'Dr. Tribhuwan Kumar Tewari': 3}|Professor and Associate Head, Dept. of CSE/IT, Jaypee Institute of Information Technology|0.0|; ; ; ; ; ; ; ; ; https://www.researchgate.net/profile/Bansidhar-Joshi/publication/363677920_Genetic_Algorithm-_and_Cuckoo_Search_Algorithm-Based_Routing_Optimizations_in_Network-on-Chip/links/65717044946088588997b4d8/Genetic-Algorithm-and-Cuckoo-Search-Algorithm-Based-Routing-Optimizations-in-Network-on-Chip.pdf; ; ; ; https://www.researchgate.net/profile/Manish-Thakur-6/publication/256077377_153395015-PaperA-Full-Reference-Algorithm-for-Dropped-Frames-Identification-in-Uncompressed-Video-Using-Genetic-Algorithm/links/0deec52170e531a90a000000/153395015-PaperA-Full-Reference-Algorithm-for-Dropped-Frames-Identification-in-Uncompressed-Video-Using-Genetic-Algorithm.pdf; https://pmc.ncbi.nlm.nih.gov/articles/PMC9127146/pdf/main.pdf; ; ; https://s3.ap-northeast-2.amazonaws.com/journal-home/journal/jips/fullText/33/jips_587.pdf; ; |nan
Prof. Shikha Mehta|Prof. Shikha Mehta|nBy-KdgAAAAJ|73|948.0|675.0|17|13.0|28|16.0|Resource provisioning and work flow scheduling in clouds using augmented Shuffled Frog Leaping Algorithm; Nature-inspired algorithms: state-of-art, problems and prospects; Concept drift in streaming data classification: algorithms, platforms and issues; A comparative study of ensemble learning methods for classification in bioinformatics; Empirical analysis of five nature-inspired algorithms on real parameter optimization problems; Social influence maximization using genetic algorithm with dynamic probabilities; Enhanced flower pollination algorithm on data clustering; Differential bond energy algorithm for optimal vertical fragmentation of distributed databases; Effective influence estimation in twitter using temporal, profile, structural and interaction characteristics; Cricket team prediction with hadoop: statistical modeling approach; Memetic collaborative filtering based recommender system; Ensemble learning approach for enhanced stock prediction; A Multi-Perspective Evaluation of ma and ga for collaborative Filtering Recommender System; A meta-heuristic density-based subspace clustering algorithm for high-dimensional data; Efficient computation offloading in mobile cloud computing with nature-inspired algorithms; Comparative analysis of nature inspired algorithms on data clustering; Context aware filtering using social behavior of frogs; Are Tweets The Real Estimators Of Election Results?; An intelligent approach for virtual chemistry laboratory; ABC_DE_FP: a novel hybrid algorithm for complex continuous optimisation problems|{'Dr. Parmeet Kaur': 9, 'Dr. Parul Agarwal': 15, 'Dr. Sakshi Gupta': 6, 'Dr. Mukta Goyal': 1, 'Prof. Mukesh Saraswat': 1, 'Deepti': 1, 'Prof. Devpriya Soni': 1}|Professor, Jaypee Institute of Information technology|0.0|; https://www.academia.edu/download/93862099/pxc3898331.pdf; https://www.sciencedirect.com/science/article/pii/S1877050917326881/pdf?md5=059047f23bc7624a7ddaa9ff92eca89f&pid=1-s2.0-S1877050917326881-main.pdf; ; https://www.researchgate.net/profile/Parul-Agarwal-3/publication/314234026_Empirical_analysis_of_five_nature-inspired_algorithms_on_real_parameter_optimization_problems/links/5a7994d40f7e9b41dbd4ab2a/Empirical-analysis-of-five-nature-inspired-algorithms-on-real-parameter-optimization-problems.pdf; ; ; ; https://www.academia.edu/download/93862386/j.ipm.2020.10232120221108-1-1pwnx46.pdf; https://www.sciencedirect.com/science/article/pii/S1877050917326479/pdf?md5=bf7693debf6b6fe231e1e83bb0bb7fd0&pid=1-s2.0-S1877050917326479-main.pdf; ; ; https://www.academia.edu/download/75730297/A_Multi_-Perspective_Evaluation_of_MA_an20211205-26897-uj4o13.pdf; https://www.researchsquare.com/article/rs-547532/latest.pdf; ; ; ; ; https://www.academia.edu/download/93862376/viewtitlesample.pdf; https://www.researchgate.net/profile/Parul-Agarwal-3/publication/326215190_ABC_DE_FP_A_Novel_Hybrid_Algorithm_for_Complex_Continuous_Optimization_Problems/links/5d7f6ebc299bf10c1ab03c70/ABC-DE-FP-A-Novel-Hybrid-Algorithm-for-Complex-Continuous-Optimization-Problems.pdf|nan
Prof. Anuja Arora|Prof.(Dr.) Anuja Arora|Uz_ML8cAAAAJ|128|2949.0|2561.0|22|20.0|44|38.0|Measuring social media influencer index-insights from Facebook, Twitter and Instagram; Linguistic feature based learning model for fake news detection and classification; Deep learning convolutional neural network for apple leaves disease detection; Text and image based spam email classification using KNN, Naïve Bayes and Reverse DBSCAN algorithm; Anomaly detection using graph neural networks; A bug mining tool to identify and analyze security bugs using naive bayes and tf-idf; Cross domain recommendation using multidimensional tensor factorization; Modeling user preferences using neural networks and tensor factorization model; Web application testing: A review on techniques, tools and state of art; Fraud detection and frequent pattern matching in insurance claims using data mining techniques; Multivariate features based instagram post analysis to enrich user experience; Brand analysis framework for online marketing: ranking web pages and analyzing popularity of brands on social media; Topic modeling driven content based jobs recommendation engine for recruitment industry; Visualization, analysis and structural pattern infusion of DBLP co-authorship network using Gephi; Brain tumor segmentation of mri images using processed image driven u-net architecture; Business competitive analysis using promoted post detection on social media; View-count based modeling for YouTube videos and weighted criteria–based ranking; ECG arrhythmia classification using spearman rank correlation and support vector machine; Automatic text summarization for Hindi using real coded genetic algorithm; Influence indexing of developers, repositories, technologies and programming languages on social coding community github|{'Dr. Niyati Aggrawal': 12, 'Dr. Arti Jain': 10, 'Dr. Amanpreet Kaur': 2, 'Dr. Kirti Aggarwal': 13, 'Dr. Parmeet Kaur': 1, 'Dr Bhawna Saxena': 1, 'Dr. Suma Dawn': 3, 'Prof. Neetu Sardana': 1, 'Dr. Tribhuwan Kumar Tewari': 1, 'Dr. Indu Chawla': 2, 'Dr. Mukta Goyal': 2}|Professor, Dept of CSE and IT, Jaypee Institute of information technology|0.0|https://www.academia.edu/download/90609289/0049214-17032019223053.pdf; ; ; ; ; ; ; ; ; ; https://www.sciencedirect.com/science/article/pii/S1877050917325814/pdf?md5=6c151e45c5912796fc4ebcaad8ce1e04&pid=1-s2.0-S1877050917325814-main.pdf&_valck=1; ; https://www.sciencedirect.com/science/article/pii/S1877050917326960/pdf?md5=48c0ab4d32c17bbee6cdd827eec32de9&pid=1-s2.0-S1877050917326960-main.pdf&_valck=1; ; ; https://www.academia.edu/download/90609333/j.jretconser.2019.10194120220903-1-crjlwd.pdf; https://www.researchgate.net/profile/Anuja-Arora/publication/335928610_View-count_based_modeling_for_YouTube_videos_and_weighted_criteria-based_ranking/links/5dde8a464585159aa44e25df/View-count-based-modeling-for-YouTube-videos-and-weighted-criteria-based-ranking.pdf; ; ; |nan
Prof. Lokendra Kumar|Prof. Lokendra Kumar|z6mGkvAAAAAJ|41|1087.0|496.0|18|14.0|22|17.0|Finite element solution of mixed convection micropolar flow driven by a porous stretching sheet; MHD mixed convection nanofluid flow and heat transfer over an inclined cylinder due to velocity and thermal slip effects: Buongiorno's model; Multiple solutions of MHD boundary layer flow and heat transfer behavior of nanofluids induced by a power-law stretching/shrinking permeable sheet with viscous dissipation; Numerical solution of free convection MHD micropolar fluid flow between two parallel porous vertical plates; Finite element analysis of combined heat and mass transfer in hydromagnetic micropolar flow along a stretching sheet; MHD slip flow and heat transfer of Al2O3-water nanofluid over a horizontal shrinking cylinder using Buongiorno’s model: Effect of nanolayer and nanoparticle diameter; Finite-element simulation of mixed convection flow of micropolar fluid over a shrinking sheet with thermal radiation; Lie group analysis for bioconvection MHD slip flow and heat transfer of nanofluid over an inclined sheet: Multiple solutions; Critical values in slip flow and heat transfer analysis of non-Newtonian nanofluid utilizing heat source/sink and variable magnetic field: Multiple solutions; Finite element modeling of a double-diffusive mixed convection flow of a chemically-reacting magneto-micropolar fluid with convective boundary condition; Finite-element analysis of transient heat and mass transfer in microstructural boundary layer flow from a porous stretching sheet; Radiative nanofluid flow and heat transfer over a non-linear permeable sheet with slip conditions and variable magnetic field: Dual solutions; Finite element analysis of MHD flow of micropolar fluid over a shrinking sheet with a convective surface boundary condition; Multiple solutions in MHD flow and heat transfer of Sisko fluid containing nanoparticles migration with a convective boundary condition: Critical points; Finite element study of radiative double-diffusive mixed convection magneto-micropolar flow in a porous medium with chemical reaction and convective condition; Finite element solution of unsteady mixed convection flow of micropolar fluid over a porous shrinking sheet; Mixed convection from a continuous surface in a parallel moving stream of a micropolar fluid; Finite element study of mixed convection micropolar flow in a vertical circular pipe with variable surface conditions; Finite element analysis of radiative mixed convection magneto‐micropolar flow in a Darcian porous medium with variable viscosity and convective surface condition; Cu–Al2O3/engine oil Williamson hybrid nanofluid flow over a stretching/shrinking Riga plate with viscous dissipation and radiation effect|nan|Department of Mathematics, Jaypee Institute of Information Technology, Noida|0.0|; ; ; https://www.academia.edu/download/54215758/Numerical_solution_of_free_convection_MH20170822-11651-1251du.pdf; ; ; ; ; ; ; https://www.researchgate.net/profile/Lokendra-Kumar-3/publication/270474389_Finite-element_analysis_of_transient_heat_and_mass_transfer_in_microstructural_boundary_layer_flow_from_a_porous_stretching_sheet/links/5656a5f308ae4988a7b4f1db/Finite-element-analysis-of-transient-heat-and-mass-transfer-in-microstructural-boundary-layer-flow-from-a-porous-stretching-sheet.pdf?_sg%5B0%5D=started_experiment_milestone&origin=journalDetail; ; ; ; ; ; https://www.academia.edu/download/54215744/s00231-002-0305-z20170822-11645-itc6oa.pdf; https://www.academia.edu/download/44930995/Finite_element_study_of_mixed_convection20160420-6783-pc42gl.pdf; ; |nan
Prof. Devpriya Soni|Dr. Devpriya Soni|D5lGxLYAAAAJ|36|656.0|583.0|14|13.0|14|13.0|['Smishing Detector: A security model to detect smishing through SMS content analysis and URL behavior analysis', 'Dsmishsms-a system to detect smishing sms', 'SARS-CoV-2 reinfection rate and estimated effectiveness of the inactivated whole virion vaccine BBV152 against reinfection among health care workers in New Delhi, India', 'SMS phishing and mitigation approaches', 'Detection of sarcasm in text data using deep convolutional neural networks', 'Placental and neonatal outcome in maternal malaria', 'Identification of sarcasm using word embeddings and hyperparameters tuning', 'Implementation of ‘smishing detector’: An efficient model for smishing detection using neural network', 'A content-based approach for detecting smishing in mobile environment', 'A framework for validation of object oriented design metrics', 'Sms phishing dataset for machine learning and pattern recognition', 'Identification of Sarcasm in Textual Data: A Comparative Study.', 'Improved UNet deep learning model for automatic detection of lung cancer nodules', 'Optimised prediction model for stock market trend analysis', 'Proposing new model for effort estimation of mobile application development', 'Cost estimation model for web applications using agile software development methodology', 'Study of arterial pattern of normal human placenta in reference to its shape.; weight and Hyrtl’s anastomosis', 'An integrated method for outlier detection with analytical study of distance based and angle based approaches', 'Observations on Object-Oriented Design Assessment and Evolving New Model', 'Cumulative-Sum Control Chart for Proportion under Inspection error', 'TEAM MEMBER SELECTION IN AGILE', 'A Methodology for Empirical Quality Assessment of Object-Oriented Design', 'Outliers in Data Mining: Approaches and Detection', 'A Comprehensive Overview on Data Mining: Approaches and Applications', 'Maintainability assessment of object-oriented design quality', 'An integrated framework for posture recognition', 'An efficient approach to book review mining using data classification', 'Evaluation of Understandability of Object-Oriented Design', 'Research Article Improved UNet Deep Learning Model for Automatic Detection of Lung Cancer Nodules', 'A Large Scale Study for Identification', 'Outlier Detection for Improving Data Robust by ODAD Clustering Technique', 'A Large Scale Study for Identification of Sarcasm in Textual Data', 'Task Allocation for Agile Teams on Fibonacci Scale', 'Prof. Bhagwati Prasad Chamola', 'Foranyquerycontact', 'Book review mining using hybrid approach for data classification']|{'Prof. Shikha Mehta': 1, 'Dr. Pulkit Mehndiratta': 5}|Professor of Computer Science and Engineering, Jaypee Institute of Information Technology|0.0|nan|nan
Prof. Neetu Sardana|Dr. Neetu Sardana|HJydVWwAAAAJ|84|548.0|432.0|12|11.0|18|12.0|"['Analysis and classification of crime tweets', 'ORFDetector: ensemble learning based online recruitment fraud detection', 'Significance of clustering coefficient over jaccard index', 'LogOptPlus: Learning to optimize logging in catch and if programming constructs', 'Empirical analysis of ensemble machine learning techniques for bug triaging', 'Eclogger: cross-project catch-block logging prediction using ensemble of classifiers', 'Visheshagya: Time based expertise model for bug report assignment', 'Analyzing performance of deep learning techniques for web navigation prediction', 'Machine learning or information retrieval techniques for bug triaging: Which is better?', 'Nrfixer: Sentiment based model for predicting the fixability of non-reproducible bugs', 'Optimizing bug report assignment using multi criteria decision making technique', 'Hopeful hearts: A mobile health care application', 'Performance assessment of bug fixing process in open source repositories', 'Two level empirical study of logging statements in open source java projects', 'Web navigation prediction based on dynamic threshold heuristics', 'Three-level learning for improving cross-project logging prediction for if-blocks', 'Improving logging prediction on imbalanced datasets: A case study on open source java projects', 'Web navigation prediction using Markov-based models: an experimental study', 'Naïve Bayes approach for predicting missing links in ego networks', 'Impact of topological properties over link prediction based on node neighbourhood: A study', 'PowKMeans: a hybrid approach for gray sheep users detection and their recommendations', 'Question tags or text for topic modeling: which is better', 'Feature ranking and aggregation for bug triaging in open-source issue tracking systems', 'An empirical study of non-reproducible bugs', 'Prediction of missing links in social networks: feature integration with node neighbour', 'Efficient bug triage in issue tracking systems', 'Developer recommendation for stack exchange software engineering Q&A website based on K-means clustering and developer social network metric', 'Elimination of backward browsing using decomposition and compression for efficient navigation prediction', 'Bug handling in service sector software', 'Efficient web navigation prediction using hybrid models based on multiple evidence combinations', 'Analytical study on bug triaging practices', 'Tagstack: Automated system for predicting tags in stackoverflow', 'Extraction of influencers across Twitter using credibility and trend analysis', 'Analysis and prediction of log statement in open source Java projects', 'ECLogger: cross-project catch-block logging prediction using ensemble of classifiers. e-Inform. Softw', 'Logger4u: Predicting debugging statements in the source code', 'IMNRFixer: A hybrid approach to alleviate class‐imbalance problem for predicting the fixability of Non‐Reproducible bugs', 'Detection of ios malware apps based on significant services identification using borda count', 'Analysis and visualization of user navigations on web', 'Characterization study of developers in non-reproducible bugs', 'Analysis and visualisation of geo-referenced tweets for real-time information diffusion', 'An empirical analysis of web navigation prediction techniques', 'Analytical study on bug triaging practices', 'Design and code time testability analysis for object oriented systems', 'Innovative way of internet voting: secure on-line vote (SOLV)', 'A Comprehensive Overview of Quantum Internet: Architecture, Protocol and Challenges', 'Performance analysis of naive Bayes classifier over similarity score-based techniques for missing link prediction in ego networks', 'Comprehensive analysis of trends in software engineering Q&A site', 'Nature inspired algorithm towards influence maximization in social networks', 'Improving logging prediction on imbalanced datasets: A case study on open source java projects', 'Logging analysis and prediction in open source java project', 'MSD-Apriori: Discovering borderline-rare items using association mining', ""Mining user's navigation structure by filtering impurity nodes for generating relevant predictions"", 'Topic Wise Influence Maximisation based on fuzzy modelling, Sentiments, Engagement, Activity and Connectivity Indexes', 'Pkm3: an optimal markov model for predicting future navigation sequences of the web surfers', 'Evaluating the Performance of Navigation Prediction Model Based on Varied Session Length', 'Comparative Study of Multilabel Classifiers on Software Engineering Q&A Community for Tag Recommendation', 'An enhanced marking target statement strategy of E-PIE for testability estimation', 'Forecasting Gold prices using Fuzzy C means', 'Malicious iOS apps detection through Multi-Criteria Decision-Making Approach', 'Efficient topic modeling for large-scale community question and answer websites', 'Tweeting the Market: Leveraging LSTM for Stock Price Prediction', 'Detection of IoT Malware using Network Forensics and Modeling.', 'PQTD-TM: Integrating Information Retrieval with Machine Learning for effective Placement Topic Discovery', 'Leveraging knowledge graphs for the analysis and recommendation of jobs', 'Global-local term fusion for optimised community Q&A topic modelling', 'An Integrated Approach using Developer Profiles with Temporal Dynamics for Assignee Recommendation in Non-Reproducible Bugs', 'Misleading multimodal news dataset for detecting fraudulent content', 'iPDS: Computing Privacy Disclosure Score for iOS apps and detection of privacy-infringing apps using Machine learning classifiers', 'Identification of Key Modules and Hub Genes Associated with COVID-19 Based on WGCNA', 'Role of Popularity and Recency for the Discovery of Experts in Stack Exchange Software Engineering Q&A Website', 'CiAFP: Category-based Classification of iOS Apps by mining frequent permissions', 'Performance Analysis of Naïve Bayes Classifier Over Similarity Score-Based Techniques for Missing Link Prediction in Ego Networks', 'Exploratory study of existing approaches for analyzing epidemics', 'Computer and Information Sciences', 'A Novel Method to Dynamically Fix Threshold for Node Neighbourhood Based Link Prediction Techniques', 'DPSN: A Novel approach for Disease Prediction based on Social Networks', 'Analysis and Visualization of Geo-Referenced Tweets for Real Time Information Diffusion', 'XML Database Storage for Web based Application', 'A Study on XML Data Indexing for Web Based Application', 'A Novel Method for Representing XML DOM Data', 'Optimizing Latent Dirichlet Allocation using Metaheuristic Technique: A Comparative Study', 'XML Database Storage for Web based Application', 'A Novel Image Steganography (NIS) Technique']"|{'Prof. Anuja Arora': 1, 'Dr. Amanpreet Kaur': 2, 'Dr. Arpita Jadhav Bhatt': 7, 'Dr. Ankit Vidyarthi': 1, 'Dr. Parmeet Kaur': 1, 'Dr. Vikash': 1}|Professor, Dept of CSE and IT, Jaypee Institute of Information Technology|0.0|nan|nan
